{
  "schema_version": "1",
  "audit_id": "issue-143-specbridge-intake-bridge",
  "auditor": "ChatGPT/Codex",
  "audit_packet_path": ".specbridge/audit-packets/issue-143-specbridge-intake-bridge.audit-packet.json",
  "execution_contract_path": ".specbridge/contracts/issue-143-specbridge-intake-bridge.execution.md",
  "final_report_path": ".specbridge/reports/issue-143-specbridge-intake-bridge.final-report.json",
  "checked_dimensions": [
    {
      "name": "spec_compliance",
      "result": "pass",
      "evidence": "specbridge-intake CLI accepts task_id, title, goal, and repository_url. Generates contract.md, scope.json, and evidence.json with all gates true. Creates branch codex/{task_id}, commits, pushes. Emits JSON summary with branch, files_created, and next_command. All per contract.",
      "blocking": false
    },
    {
      "name": "acceptance_criteria",
      "result": "pass",
      "evidence": "specbridge-intake command added to ValidateSet and switch block. specbridge-intake.yml workflow_dispatch action created with task_id, title, goal inputs. Output includes next-step command. All validators and CLI tests pass.",
      "blocking": false
    },
    {
      "name": "policy_boundaries",
      "result": "pass",
      "evidence": "specbridge-intake generates governance files only — no GitHub mutations, no secrets, no deployment, no production. The GitHub Action uses scoped GITHUB_TOKEN (contents/issues/pull-requests write). Existing CI/CD workflows not modified.",
      "blocking": false
    },
    {
      "name": "security_rules",
      "result": "pass",
      "evidence": "No protected files changed. No credentials accessed. Authentication, authorization, billing untouched. The action does not embed secrets — uses GITHUB_TOKEN from the workflow context.",
      "blocking": false
    },
    {
      "name": "changed_file_scope",
      "result": "pass",
      "evidence": "All changed files declared in .specbridge/scopes/issue-143-specbridge-intake-bridge.scope.json. specbridge-intake.yml is a new file, not a modification of an existing protected workflow.",
      "blocking": false
    },
    {
      "name": "test_evidence",
      "result": "pass",
      "evidence": "CLI test suite passes. specbridge-intake command added to ValidateSet so parameter validation works. All PASS, no FAIL.",
      "blocking": false
    },
    {
      "name": "ci_evidence",
      "result": "pass",
      "evidence": "GitHub CI pending for issue 143 branch. Final report marks CI as not_collected. ci_wait will poll after PR opens.",
      "blocking": false
    },
    {
      "name": "final_report_honesty",
      "result": "pass",
      "evidence": "Final report accurately records the implementation: specbridge-intake CLI and GitHub Action added. Risks documented: action write permissions, all-gates-true evidence generation. Completion status is complete_pending_apply_mode_run.",
      "blocking": false
    }
  ],
  "findings": [
    {
      "severity": "info",
      "category": "all_gates_true_on_intake",
      "file": "scripts/specbridge.ps1",
      "line": null,
      "evidence": "specbridge-intake sets all evidence gates to true at generation time. This means the operator will execute without a separate human review step. The intake call itself is treated as the authorization signal.",
      "recommendation": "Consider adding a -RequireHumanReview flag in a future task that sets chatgpt_audit_approved and review_gate_passed to false, requiring manual gate update before the operator can run.",
      "blocking": false
    },
    {
      "severity": "info",
      "category": "workflow_write_permissions",
      "file": ".github/workflows/specbridge-intake.yml",
      "line": null,
      "evidence": "The action has contents: write and pull-requests: write permissions. Any user or system with workflow trigger access can create branches and commits.",
      "recommendation": "Add an environment protection rule in GitHub repository settings to require approval before the intake action can run, if stricter control is needed.",
      "blocking": false
    }
  ],
  "outcome": "approved",
  "merge_allowed": true,
  "unresolved_risks": [
    "GitHub CI and PR merge pending for issue 143 branch.",
    "All-gates-true evidence generation bypasses manual review steps.",
    "Action write permissions allow any workflow trigger caller to create branches."
  ],
  "source_files": [
    "scripts/specbridge.ps1",
    ".github/workflows/specbridge-intake.yml",
    ".specbridge/audit-packets/issue-143-specbridge-intake-bridge.audit-packet.json",
    ".specbridge/audits/issue-143-specbridge-intake-bridge.chatgpt-audit.json",
    ".specbridge/contracts/issue-143-specbridge-intake-bridge.execution.md",
    ".specbridge/reports/issue-143-specbridge-intake-bridge.final-report.json",
    ".specbridge/scopes/issue-143-specbridge-intake-bridge.scope.json",
    "README.md"
  ]
}
