{
  "schema_version": "1",
  "audit_id": "issue-1-unique-ai-ci-claude-pilot",
  "auditor": "ChatGPT/Codex",
  "audit_packet_path": ".specbridge/audit-packets/issue-1-unique-ai-ci-claude-pilot.audit-packet.json",
  "execution_contract_path": ".specbridge/contracts/issue-1-unique-ai-ci-claude-pilot.execution.md",
  "final_report_path": ".specbridge/reports/issue-1-unique-ai-ci-claude-pilot.final-report.json",
  "checked_dimensions": [
    {"name": "spec_compliance", "result": "pass", "evidence": "Claude implemented first inside exact scope; Codex audited and recorded two focused gate corrections.", "blocking": false},
    {"name": "acceptance_criteria", "result": "pass", "evidence": "Provider-neutral CI, inherited provider-workflow removal, authorization, validator, tests, docs, runtime evidence, PR, and passing checks are present.", "blocking": false},
    {"name": "policy_boundaries", "result": "pass", "evidence": "High-risk workflow paths are explicitly authorized; no blocked secret, dependency, production, deployment, billing, auth, database, force-push, or unlisted workflow operation occurred.", "blocking": false},
    {"name": "security_rules", "result": "pass", "evidence": "New workflows use contents read, no provider action or API-key secret, and both execute the existing security gate.", "blocking": false},
    {"name": "changed_file_scope", "result": "pass", "evidence": "Every changed or deleted file is listed in the issue #1 scope manifest.", "blocking": false},
    {"name": "test_evidence", "result": "pass", "evidence": "128 local tests pass; contract, scope, authority, security, review, and whitespace checks pass.", "blocking": false},
    {"name": "ci_evidence", "result": "pass", "evidence": "unique-ai-ci, validate-foundation, review-gate, and generate-pr-review-report passed on PR #2 after the focused CI fix.", "blocking": false},
    {"name": "final_report_honesty", "result": "pass", "evidence": "The report distinguishes ready-for-merge state from pending merge, branch protection, issue closure, and deployment.", "blocking": false}
  ],
  "findings": [
    {"severity": "info", "category": "post_merge_protection", "file": ".specbridge/reports/issue-1-unique-ai-ci-claude-pilot.final-report.json", "line": null, "evidence": "Main protection was applied after merge with strict unique-ai-ci, admin enforcement, conversation resolution, force-push disabled, and deletion disabled.", "recommendation": "Keep the required check stable and renew workflow authorization before any future CI change.", "blocking": false}
  ],
  "outcome": "approved",
  "merge_allowed": true,
  "unresolved_risks": [
    "No production deployment is authorized."
  ],
  "source_files": [
    ".specbridge/contracts/issue-1-unique-ai-ci-claude-pilot.execution.md",
    ".specbridge/scopes/issue-1-unique-ai-ci-claude-pilot.scope.json",
    ".specbridge/runtime-evidence/issue-1-unique-ai-ci-claude-pilot.md",
    ".specbridge/reports/issue-1-unique-ai-ci-claude-pilot.final-report.json",
    ".specbridge/audit-packets/issue-1-unique-ai-ci-claude-pilot.audit-packet.json"
  ]
}
