{
  "schema_version": "1",
  "audit_id": "issue-057-multi-agent-coordinator",
  "auditor": "ChatGPT/Codex",
  "audit_packet_path": ".specbridge/audit-packets/issue-057-multi-agent-coordinator.audit-packet.json",
  "execution_contract_path": ".specbridge/contracts/issue-057-multi-agent-coordinator.execution.md",
  "final_report_path": ".specbridge/reports/issue-057-multi-agent-coordinator.final-report.json",
  "checked_dimensions": [
    {
      "name": "spec_compliance",
      "result": "pass",
      "evidence": "The pilot defines Agent A, Agent B, Agent C, and a coordinator with separate contracts, scopes, outputs, final reports, and integration evidence.",
      "blocking": false
    },
    {
      "name": "acceptance_criteria",
      "result": "pass",
      "evidence": "The issue 057 final report maps to AC-076 through AC-084, including decomposition evidence, per-agent contracts, scope manifests, final reports, and smoke-wired validation.",
      "blocking": false
    },
    {
      "name": "policy_boundaries",
      "result": "pass",
      "evidence": "The task is repository-first and limited to artifacts, docs, and deterministic local scripts inside the declared coordinator scope.",
      "blocking": false
    },
    {
      "name": "security_rules",
      "result": "pass",
      "evidence": "The pilot does not add secrets, production configuration, billing, authentication implementation, authorization implementation, dependency installation, CI/CD security weakening, network calls, or deployment automation.",
      "blocking": false
    },
    {
      "name": "changed_file_scope",
      "result": "pass",
      "evidence": "Changed files are listed in the coordinator final report and covered by agent or coordinator scope manifests.",
      "blocking": false
    },
    {
      "name": "test_evidence",
      "result": "pass",
      "evidence": "scripts/test-specbridge-multi-agent-pilot.ps1 passed for a three-agent decomposition and duplicate write-scope rejection.",
      "blocking": false
    },
    {
      "name": "ci_evidence",
      "result": "needs_human_decision",
      "evidence": "GitHub CI evidence is pending until the branch is pushed and pull request checks complete.",
      "blocking": false
    },
    {
      "name": "final_report_honesty",
      "result": "pass",
      "evidence": "The coordinator final report records pending CI and explicitly states that live parallel Antigravity sessions remain future runtime work.",
      "blocking": false
    }
  ],
  "findings": [
    {
      "severity": "info",
      "category": "runtime_boundary",
      "file": ".specbridge/reports/issue-057-multi-agent-coordinator.final-report.json",
      "line": null,
      "evidence": "The pilot simulates parallel executor outputs in one integration branch rather than launching separate live Claude Code sessions.",
      "recommendation": "Use this evidence structure for the next live Antigravity executor orchestration milestone.",
      "blocking": false
    }
  ],
  "outcome": "needs_human_decision",
  "merge_allowed": false,
  "unresolved_risks": [
    "CI evidence is pending until GitHub checks run.",
    "Live parallel Antigravity executor sessions remain future runtime work."
  ],
  "source_files": [
    ".specbridge/audit-packets/issue-057-multi-agent-coordinator.audit-packet.json",
    ".specbridge/contracts/issue-057-multi-agent-coordinator.execution.md",
    ".specbridge/reports/issue-057-multi-agent-coordinator.final-report.json"
  ]
}
