{
  "schema_version": "1",
  "audit_id": "issue-073-standard-loop-v1",
  "auditor": "ChatGPT/Codex",
  "audit_packet_path": ".specbridge/audit-packets/issue-073-standard-loop-v1.audit-packet.json",
  "execution_contract_path": ".specbridge/contracts/issue-073-standard-loop-v1.execution.md",
  "final_report_path": ".specbridge/reports/issue-073-standard-loop-v1.final-report.json",
  "checked_dimensions": [
    {
      "name": "spec_compliance",
      "result": "pass",
      "evidence": "Issue 073 follows the requested order: real feature pilot, templates, controlled runner, schemas, CI authority, Standard Loop v1, and V5 boundary.",
      "blocking": false
    },
    {
      "name": "acceptance_criteria",
      "result": "pass",
      "evidence": "AC-216 through AC-233 and AT-036 are represented by docs, templates, schema registration, CLI commands, runtime execution evidence, validators, CLI coverage, negative coverage, final report, audit packet, and ChatGPT/Codex audit.",
      "blocking": false
    },
    {
      "name": "policy_boundaries",
      "result": "pass",
      "evidence": "The task stayed inside the issue 073 contract and scope manifest. Workflow files remained read-only and CI authority is documented against existing GitHub CI workflows.",
      "blocking": false
    },
    {
      "name": "security_rules",
      "result": "pass",
      "evidence": "The controlled runner dry-run records false execution policy booleans for Claude launch, Antigravity launch, shell execution, network, protected resources, production, dependency installation, and deployment.",
      "blocking": false
    },
    {
      "name": "changed_file_scope",
      "result": "pass",
      "evidence": "Changed files are listed in the final report and covered by the issue 073 scope manifest. Local untracked .agents and .claude/settings.local.json remain outside staged task scope.",
      "blocking": false
    },
    {
      "name": "test_evidence",
      "result": "pass",
      "evidence": "Standard validation, CLI tests, negative validation tests, smoke validation, runtime execution validation, template validation, CI authority validation, schema validation, final report validation, audit packet validation, ChatGPT audit validation, security gate, review gate, standard-loop-status, execute-runtime-launch dry-run, and git diff whitespace validation are recorded as passed or not_collected where external CI is pending.",
      "blocking": false
    },
    {
      "name": "ci_evidence",
      "result": "pass",
      "evidence": "Local CI-equivalent validation passed. GitHub PR CI remains a required external merge gate and must pass before automatic merge.",
      "blocking": false
    },
    {
      "name": "final_report_honesty",
      "result": "pass",
      "evidence": "The final report records changed files, local validation evidence, GitHub CI not_collected before push, no deployment, and V5 live parallel execution as future work.",
      "blocking": false
    }
  ],
  "findings": [
    {
      "severity": "info",
      "category": "standard_loop",
      "file": "docs/specbridge-standard-loop-v1.md",
      "line": null,
      "evidence": "Standard Loop v1 now defines the canonical path from goal to policy-gated merge and points live parallel execution to a future V5 contract.",
      "recommendation": "Use the next dedicated contract to run a small live parallel Antigravity pilot only after GitHub CI passes for this package.",
      "blocking": false
    }
  ],
  "outcome": "approved",
  "merge_allowed": true,
  "unresolved_risks": [
    "GitHub PR CI evidence is pending until the branch is pushed and checks run.",
    "V5 live parallel Antigravity execution remains planned and requires a dedicated future contract before live multi-session execution."
  ],
  "source_files": [
    ".specbridge/audit-packets/issue-073-standard-loop-v1.audit-packet.json",
    ".specbridge/contracts/issue-073-standard-loop-v1.execution.md",
    ".specbridge/reports/issue-073-standard-loop-v1.final-report.json"
  ]
}
