{
  "schema_version": "1",
  "audit_id": "issue-126-apply-mode-merge",
  "auditor": "ChatGPT/Codex",
  "audit_packet_path": ".specbridge/audit-packets/issue-126-apply-mode-merge.audit-packet.json",
  "execution_contract_path": ".specbridge/contracts/issue-126-apply-mode-merge.execution.md",
  "final_report_path": ".specbridge/reports/issue-126-apply-mode-merge.final-report.json",
  "checked_dimensions": [
    {
      "name": "spec_compliance",
      "result": "pass",
      "evidence": "Issue 126 follows the established apply-mode expansion pattern (119 → 123 → 126). merge operation added with PR auto-detection and --squash --auto flags. Pilot scope guard updated. Tests updated.",
      "blocking": false
    },
    {
      "name": "acceptance_criteria",
      "result": "pass",
      "evidence": "gh pr view auto-detects PR number. gh pr merge --squash --auto executes. Pilot guard allows issue_close, pr_open, merge. ci_wait unsupported op test passes. command_boundary updated. All validators pass.",
      "blocking": false
    },
    {
      "name": "policy_boundaries",
      "result": "pass",
      "evidence": "Changes limited to scripts, docs, evidence, and artifacts. apply-mode merge bounded by 7 evidence gates and --auto flag (merge still requires CI). No secrets, production, billing, auth, database, CI/CD security, or deployment files changed.",
      "blocking": false
    },
    {
      "name": "security_rules",
      "result": "pass",
      "evidence": "All changed files within declared scope. No protected paths touched.",
      "blocking": false
    },
    {
      "name": "changed_file_scope",
      "result": "pass",
      "evidence": "All changed files declared in .specbridge/scopes/issue-126-apply-mode-merge.scope.json.",
      "blocking": false
    },
    {
      "name": "test_evidence",
      "result": "pass",
      "evidence": "All validators passed locally including full CLI test suite. apply-unsupported-op now correctly tests ci_wait and new boundary string.",
      "blocking": false
    },
    {
      "name": "ci_evidence",
      "result": "pass",
      "evidence": "GitHub CI is pending for the issue 126 PR and remains an external merge gate. Final report marks CI as not_collected.",
      "blocking": false
    },
    {
      "name": "final_report_honesty",
      "result": "pass",
      "evidence": "Final report accurately records local completion pending PR CI without claiming post-merge facts.",
      "blocking": false
    }
  ],
  "findings": [
    {
      "severity": "info",
      "category": "external_lifecycle_pending",
      "file": ".specbridge/reports/issue-126-apply-mode-merge.final-report.json",
      "line": null,
      "evidence": "PR, CI, and merge for issue 126 are pending external GitHub gates.",
      "recommendation": "Wait for CI, then merge if policy gates pass. Then proceed to issue 127 (full end-to-end apply-mode loop test).",
      "blocking": false
    }
  ],
  "outcome": "approved",
  "merge_allowed": true,
  "unresolved_risks": [
    "GitHub CI and PR merge pending for issue 126 branch."
  ],
  "source_files": [
    ".specbridge/audit-packets/issue-126-apply-mode-merge.audit-packet.json",
    ".specbridge/audits/issue-126-apply-mode-merge.chatgpt-audit.json",
    ".specbridge/contracts/issue-126-apply-mode-merge.execution.md",
    ".specbridge/github-evidence/issue-126-apply-mode-merge.github-mutation-evidence.json",
    ".specbridge/reports/issue-126-apply-mode-merge.final-report.json",
    ".specbridge/scopes/issue-126-apply-mode-merge.scope.json",
    "README.md",
    "scripts/specbridge.ps1",
    "scripts/test-specbridge-cli.ps1"
  ]
}
