{
  "schema_version": "1",
  "audit_id": "issue-131-post-merge-closure-126-127",
  "auditor": "ChatGPT/Codex",
  "audit_packet_path": ".specbridge/audit-packets/issue-131-post-merge-closure-126-127.audit-packet.json",
  "execution_contract_path": ".specbridge/contracts/issue-131-post-merge-closure-126-127.execution.md",
  "final_report_path": ".specbridge/reports/issue-131-post-merge-closure-126-127.final-report.json",
  "checked_dimensions": [
    {
      "name": "spec_compliance",
      "result": "pass",
      "evidence": "Issue 131 follows the established post-merge memory closure pattern. PR 130 merged, issue-127 evidence updated, scope completed, closure artifacts created for both 126 and 127.",
      "blocking": false
    },
    {
      "name": "acceptance_criteria",
      "result": "pass",
      "evidence": "Issue-127 evidence has github_ci_passed true. Issue-127 scope completed. Closure artifacts for both 126 and 127 created. CURRENT_GOAL and README updated. All validators pass.",
      "blocking": false
    },
    {
      "name": "policy_boundaries",
      "result": "pass",
      "evidence": "Changes limited to evidence, memory, and closure artifacts only. No code changes. No secrets, production, billing, auth, database, CI/CD security, or deployment files changed.",
      "blocking": false
    },
    {
      "name": "security_rules",
      "result": "pass",
      "evidence": "All changed files within declared scope. No protected paths touched.",
      "blocking": false
    },
    {
      "name": "changed_file_scope",
      "result": "pass",
      "evidence": "All changed files declared in .specbridge/scopes/issue-131-post-merge-closure-126-127.scope.json.",
      "blocking": false
    },
    {
      "name": "test_evidence",
      "result": "pass",
      "evidence": "All validators passed locally. No test code changes in this closure.",
      "blocking": false
    },
    {
      "name": "ci_evidence",
      "result": "pass",
      "evidence": "GitHub CI is pending for the issue 131 PR and remains an external merge gate. Final report marks CI as not_collected.",
      "blocking": false
    },
    {
      "name": "final_report_honesty",
      "result": "pass",
      "evidence": "Final report accurately records issue-127 closure and issue-126 pending status. Issue-126 closure marked as pending in closure artifact.",
      "blocking": false
    }
  ],
  "findings": [
    {
      "severity": "info",
      "category": "external_lifecycle_pending",
      "file": ".specbridge/github-evidence/issue-126-apply-mode-merge.closure.json",
      "line": null,
      "evidence": "Issue 126 PR 129 still pending CI at time of issue 131 closure. Issue-126 closure artifact has pr_merged=false and github_ci_passed=false.",
      "recommendation": "After PR 129 merges, update issue-126 closure artifact and evidence to reflect final CI/merge state.",
      "blocking": false
    }
  ],
  "outcome": "approved",
  "merge_allowed": true,
  "unresolved_risks": [
    "GitHub CI and PR merge pending for issue 131 branch.",
    "Issue 126 PR (129) pending CI at time of closure."
  ],
  "source_files": [
    ".specbridge/audit-packets/issue-131-post-merge-closure-126-127.audit-packet.json",
    ".specbridge/audits/issue-131-post-merge-closure-126-127.chatgpt-audit.json",
    ".specbridge/contracts/issue-131-post-merge-closure-126-127.execution.md",
    ".specbridge/github-evidence/issue-126-apply-mode-merge.closure.json",
    ".specbridge/github-evidence/issue-127-full-loop-test.closure.json",
    ".specbridge/github-evidence/issue-127-full-loop-test.github-mutation-evidence.json",
    ".specbridge/reports/issue-131-post-merge-closure-126-127.final-report.json",
    ".specbridge/scopes/issue-131-post-merge-closure-126-127.scope.json",
    "README.md"
  ]
}
